mysql> show tables;
+----------------+
| Tables_in_mydb |
+----------------+
| Books          |
| Cars           |
| Customers      |
| Reservations   |
+----------------+
4 rows in set (0.00 sec)

mysql> show databases;
+--------------------+
| Database           |
+--------------------+
| information_schema |
| mydb               |
+--------------------+
2 rows in set (0.00 sec)

mysql> use mydb
Database changed
mysql> describe Cars;
+-------+-------------+------+-----+---------+-------+
| Field | Type        | Null | Key | Default | Extra |
+-------+-------------+------+-----+---------+-------+
| Id    | int(11)     | NO   | PRI | NULL    |       |
| Name  | varchar(50) | YES  |     | NULL    |       |
| Cost  | int(11)     | YES  |     | NULL    |       |
+-------+-------------+------+-----+---------+-------+
3 rows in set (0.00 sec)

mysql> select * from Cars;
+----+------------+--------+
| Id | Name       | Cost   |
+----+------------+--------+
|  1 | Audi       |  52642 |
|  2 | Mercedes   |  57127 |
|  3 | Skoda      |   9000 |
|  4 | Volvo      |  29000 |
|  5 | Bentley    | 350000 |
|  6 | Citroen    |  21000 |
|  7 | Hummer     |  41400 |
|  8 | Volkswagen |  21600 |
+----+------------+--------+
8 rows in set (0.00 sec)

mysql> show create table Cars;
+-------+------------------------------------------------------------------------------------------------------------------------------------------------------------------------------+
| Table | Create Table                                                                                                                                                                 |
+-------+------------------------------------------------------------------------------------------------------------------------------------------------------------------------------+
| Cars  | CREATE TABLE `Cars` (
  `Id` int(11) NOT NULL,
  `Name` varchar(50) DEFAULT NULL,
  `Cost` int(11) DEFAULT NULL,
  PRIMARY KEY (`Id`)
) ENGINE=InnoDB DEFAULT CHARSET=latin1 |
+-------+------------------------------------------------------------------------------------------------------------------------------------------------------------------------------+
1 row in set (0.00 sec)

mysql> show tables;
+----------------+
| Tables_in_mydb |
+----------------+
| Books          |
| Cars           |
| Customers      |
| Reservations   |
+----------------+
4 rows in set (0.00 sec)

mysql> select * from Customers;
+------------+-------------+
| CustomerId | Name        |
+------------+-------------+
|          1 | Paul Novak  |
|          2 | Terry Neils |
|          3 | Jack Fonda  |
|          4 | Tom Willis  |
+------------+-------------+
4 rows in set (0.00 sec)

mysql> describe Reservations;
+------------+---------+------+-----+---------+----------------+
| Field      | Type    | Null | Key | Default | Extra          |
+------------+---------+------+-----+---------+----------------+
| Id         | int(11) | NO   | PRI | NULL    | auto_increment |
| CustomerId | int(11) | YES  |     | NULL    |                |
| Day        | date    | YES  |     | NULL    |                |
+------------+---------+------+-----+---------+----------------+
3 rows in set (0.00 sec)

mysql> select * from Reservations;
+----+------------+------------+
| Id | CustomerId | Day        |
+----+------------+------------+
|  1 |          1 | 2009-11-22 |
|  2 |          2 | 2009-11-28 |
|  3 |          2 | 2009-11-29 |
|  4 |          1 | 2009-11-29 |
|  5 |          3 | 2009-12-02 |
+----+------------+------------+
5 rows in set (0.00 sec)

mysql> exit
mysql> use world;
Reading table information for completion of table and column names
You can turn off this feature to get a quicker startup with -A

Database changed
mysql> select count(Id) as 'Number of rows' from City;
+----------------+
| Number of rows |
+----------------+
|           4079 |
+----------------+
1 row in set (0.00 sec)

mysql> 
mysql> show tables
    -> ;
+-----------------+
| Tables_in_world |
+-----------------+
| City            |
| Country         |
| CountryLanguage |
+-----------------+
3 rows in set (0.01 sec)

mysql> select Name, Population from City
    -> where Population  (select Max(Population) from City);
ERROR 1064 (42000): You have an error in your SQL syntax; check the manual that corresponds to your MySQL server version for the right syntax to use near 'select Max(Population) from City)' at line 2
mysql> Des City
    -> ;
ERROR 1064 (42000): You have an error in your SQL syntax; check the manual that corresponds to your MySQL server version for the right syntax to use near 'Des City' at line 1
mysql> desc City;
+-------------+----------+------+-----+---------+----------------+
| Field       | Type     | Null | Key | Default | Extra          |
+-------------+----------+------+-----+---------+----------------+
| ID          | int(11)  | NO   | PRI | NULL    | auto_increment |
| Name        | char(35) | NO   |     |         |                |
| CountryCode | char(3)  | NO   |     |         |                |
| District    | char(20) | NO   |     |         |                |
| Population  | int(11)  | NO   |     | 0       |                |
+-------------+----------+------+-----+---------+----------------+
5 rows in set (0.00 sec)

mysql> SELECT Name, Population FROM City
    -> WHERE Population = (SELECT Max(Population) FROM City);
+-----------------+------------+
| Name            | Population |
+-----------------+------------+
| Mumbai (Bombay) |   10500000 |
+-----------------+------------+
1 row in set (0.00 sec)

mysql> SELECT Name, Population FROM City 
    -> WHERE Population = (SELECT Min(Population) FROM City);
+-----------+------------+
| Name      | Population |
+-----------+------------+
| Adamstown |         42 |
+-----------+------------+
1 row in set (0.00 sec)

mysql> SELECT Name, Population FROM City 
    -> WHERE Population > 1000000;
+--------------------------+------------+
| Name                     | Population |
+--------------------------+------------+
| Kabul                    |    1780000 |
| Alger                    |    2168000 |
| Luanda                   |    2022000 |
| Buenos Aires             |    2982146 |
| La Matanza               |    1266461 |
| Córdoba                  |    1157507 |
| Yerevan                  |    1248700 |
| Sydney                   |    3276207 |
| Melbourne                |    2865329 |
| Brisbane                 |    1291117 |
| Perth                    |    1096829 |
| Baku                     |    1787800 |
| Dhaka                    |    3612850 |
| Chittagong               |    1392860 |
| São Paulo                |    9968485 |
| Rio de Janeiro           |    5598953 |
| Salvador                 |    2302832 |
| Belo Horizonte           |    2139125 |
| Fortaleza                |    2097757 |
| Brasília                 |    1969868 |
| Curitiba                 |    1584232 |
| Recife                   |    1378087 |
| Porto Alegre             |    1314032 |
| Manaus                   |    1255049 |
| Belém                    |    1186926 |
| Guarulhos                |    1095874 |
| Goiânia                  |    1056330 |
| London                   |    7285000 |
| Birmingham               |    1013000 |
| Sofija                   |    1122302 |
| Santiago de Chile        |    4703954 |
| Santo Domingo de Guzmán  |    1609966 |
| Guayaquil                |    2070040 |
| Quito                    |    1573458 |
| Cairo                    |    6789479 |
| Alexandria               |    3328196 |
| Giza                     |    2221868 |
| Madrid                   |    2879052 |
| Barcelona                |    1503451 |
| Cape Town                |    2352121 |
| Addis Abeba              |    2495000 |
| Quezon                   |    2173831 |
| Manila                   |    1581082 |
| Kalookan                 |    1177604 |
| Davao                    |    1147116 |
| Tbilisi                  |    1235200 |
| Accra                    |    1070000 |
| Conakry                  |    1090610 |
| Kowloon and New Kowloon  |    1987996 |
| Victoria                 |    1312637 |
| Jakarta                  |    9604900 |
| Surabaya                 |    2663820 |
| Bandung                  |    2429000 |
| Medan                    |    1843919 |
| Palembang                |    1222764 |
| Tangerang                |    1198300 |
| Semarang                 |    1104405 |
| Ujung Pandang            |    1060257 |
| Mumbai (Bombay)          |   10500000 |
| Delhi                    |    7206704 |
| Calcutta [Kolkata]       |    4399819 |
| Chennai (Madras)         |    3841396 |
| Hyderabad                |    2964638 |
| Ahmedabad                |    2876710 |
| Bangalore                |    2660088 |
| Kanpur                   |    1874409 |
| Nagpur                   |    1624752 |
| Lucknow                  |    1619115 |
| Pune                     |    1566651 |
| Surat                    |    1498817 |
| Jaipur                   |    1458483 |
| Indore                   |    1091674 |
| Bhopal                   |    1062771 |
| Ludhiana                 |    1042740 |
| Vadodara (Baroda)        |    1031346 |
| Kalyan                   |    1014557 |
| Baghdad                  |    4336000 |
| Teheran                  |    6758845 |
| Mashhad                  |    1887405 |
| Esfahan                  |    1266072 |
| Tabriz                   |    1191043 |
| Shiraz                   |    1053025 |
| Roma                     |    2643581 |
| Milano                   |    1300977 |
| Napoli                   |    1002619 |
| Wien                     |    1608144 |
| Tokyo                    |    7980230 |
| Jokohama [Yokohama]      |    3339594 |
| Osaka                    |    2595674 |
| Nagoya                   |    2154376 |
| Sapporo                  |    1790886 |
| Kioto                    |    1461974 |
| Kobe                     |    1425139 |
| Fukuoka                  |    1308379 |
| Kawasaki                 |    1217359 |
| Hiroshima                |    1119117 |
| Kitakyushu               |    1016264 |
| Beograd                  |    1204000 |
| Douala                   |    1448300 |
| Yaoundé                  |    1372800 |
| Montréal                 |    1016376 |
| Almaty                   |    1129400 |
| Nairobi                  |    2290000 |
| Shanghai                 |    9696300 |
| Peking                   |    7472000 |
| Chongqing                |    6351600 |
| Tianjin                  |    5286800 |
| Wuhan                    |    4344600 |
| Harbin                   |    4289800 |
| Shenyang                 |    4265200 |
| Kanton [Guangzhou]       |    4256300 |
| Chengdu                  |    3361500 |
| Nanking [Nanjing]        |    2870300 |
| Changchun                |    2812000 |
| Xi´an                    |    2761400 |
| Dalian                   |    2697000 |
| Qingdao                  |    2596000 |
| Jinan                    |    2278100 |
| Hangzhou                 |    2190500 |
| Zhengzhou                |    2107200 |
| Shijiazhuang             |    2041500 |
| Taiyuan                  |    1968400 |
| Kunming                  |    1829500 |
| Changsha                 |    1809800 |
| Nanchang                 |    1691600 |
| Fuzhou                   |    1593800 |
| Lanzhou                  |    1565800 |
| Guiyang                  |    1465200 |
| Ningbo                   |    1371200 |
| Hefei                    |    1369100 |
| Urumtši [Ürümqi]         |    1310100 |
| Anshan                   |    1200000 |
| Fushun                   |    1200000 |
| Nanning                  |    1161800 |
| Zibo                     |    1140000 |
| Qiqihar                  |    1070000 |
| Jilin                    |    1040000 |
| Tangshan                 |    1040000 |
| Santafé de Bogotá        |    6260862 |
| Cali                     |    2077386 |
| Medellín                 |    1861265 |
| Barranquilla             |    1223260 |
| Kinshasa                 |    5064000 |
| Pyongyang                |    2484000 |
| Seoul                    |    9981619 |
| Pusan                    |    3804522 |
| Inchon                   |    2559424 |
| Taegu                    |    2548568 |
| Taejon                   |    1425835 |
| Kwangju                  |    1368341 |
| Ulsan                    |    1084891 |
| La Habana                |    2256000 |
| Beirut                   |    1100000 |
| Tripoli                  |    1682000 |
| Kuala Lumpur             |    1297526 |
| Casablanca               |    2940623 |
| Ciudad de México         |    8591309 |
| Guadalajara              |    1647720 |
| Ecatepec de Morelos      |    1620303 |
| Puebla                   |    1346176 |
| Nezahualcóyotl           |    1224924 |
| Juárez                   |    1217818 |
| Tijuana                  |    1212232 |
| León                     |    1133576 |
| Monterrey                |    1108499 |
| Zapopan                  |    1002239 |
| Maputo                   |    1018938 |
| Rangoon (Yangon)         |    3361700 |
| Lagos                    |    1518000 |
| Ibadan                   |    1432000 |
| Abidjan                  |    2500000 |
| Karachi                  |    9269265 |
| Lahore                   |    5063499 |
| Faisalabad               |    1977246 |
| Rawalpindi               |    1406214 |
| Multan                   |    1182441 |
| Hyderabad                |    1151274 |
| Gujranwala               |    1124749 |
| Lima                     |    6464693 |
| Warszawa                 |    1615369 |
| Paris                    |    2125246 |
| Bucuresti                |    2016131 |
| Berlin                   |    3386667 |
| Hamburg                  |    1704735 |
| Munich [München]         |    1194560 |
| Lusaka                   |    1317000 |
| Riyadh                   |    3324000 |
| Jedda                    |    2046300 |
| Singapore                |    4017733 |
| Omdurman                 |    1271403 |
| Damascus                 |    1347000 |
| Aleppo                   |    1261983 |
| Taipei                   |    2641312 |
| Kaohsiung                |    1475505 |
| Dar es Salaam            |    1747000 |
| Bangkok                  |    6320174 |
| Praha                    |    1181126 |
| Istanbul                 |    8787958 |
| Ankara                   |    3038159 |
| Izmir                    |    2130359 |
| Adana                    |    1131198 |
| Bursa                    |    1095842 |
| Kyiv                     |    2624000 |
| Harkova [Harkiv]         |    1500000 |
| Dnipropetrovsk           |    1103000 |
| Donetsk                  |    1050000 |
| Odesa                    |    1011000 |
| Budapest                 |    1811552 |
| Montevideo               |    1236000 |
| Toskent                  |    2117500 |
| Minsk                    |    1674000 |
| Caracas                  |    1975294 |
| Maracaíbo                |    1304776 |
| Moscow                   |    8389200 |
| St Petersburg            |    4694000 |
| Novosibirsk              |    1398800 |
| Nizni Novgorod           |    1357000 |
| Jekaterinburg            |    1266300 |
| Samara                   |    1156100 |
| Omsk                     |    1148900 |
| Kazan                    |    1101000 |
| Ufa                      |    1091200 |
| Tšeljabinsk              |    1083200 |
| Rostov-na-Donu           |    1012700 |
| Perm                     |    1009700 |
| Ho Chi Minh City         |    3980000 |
| Hanoi                    |    1410000 |
| New York                 |    8008278 |
| Los Angeles              |    3694820 |
| Chicago                  |    2896016 |
| Houston                  |    1953631 |
| Philadelphia             |    1517550 |
| Phoenix                  |    1321045 |
| San Diego                |    1223400 |
| Dallas                   |    1188580 |
| San Antonio              |    1144646 |
| Harare                   |    1410000 |
+--------------------------+------------+
237 rows in set (0.00 sec)

mysql> pager less
PAGER set to 'less'
mysql> SELECT Name, Population FROM City 
    -> WHERE Population > 1000000;
+--------------------------+------------+
| Name                     | Population |
+--------------------------+------------+
| Kabul                    |    1780000 |
| Alger                    |    2168000 |
| Luanda                   |    2022000 |
| Buenos Aires             |    2982146 |
| La Matanza               |    1266461 |
| Córdoba                  |    1157507 |
| Yerevan                  |    1248700 |
| Sydney                   |    3276207 |
| Melbourne                |    2865329 |
| Brisbane                 |    1291117 |
| Perth                    |    1096829 |
| Baku                     |    1787800 |
| Dhaka                    |    3612850 |
| Chittagong               |    1392860 |
| São Paulo                |    9968485 |
| Rio de Janeiro           |    5598953 |
| Salvador                 |    2302832 |
| Belo Horizonte           |    2139125 |
| Fortaleza                |    2097757 |
| Brasília                 |    1969868 |
| Curitiba                 |    1584232 |
| Recife                   |    1378087 |
| Porto Alegre             |    1314032 |
| Manaus                   |    1255049 |
| Belém                    |    1186926 |
| Guarulhos                |    1095874 |
| Goiânia                  |    1056330 |
| London                   |    7285000 |
| Birmingham               |    1013000 |
| Sofija                   |    1122302 |
| Santiago de Chile        |    4703954 |
| Santo Domingo de Guzmán  |    1609966 |
| Guayaquil                |    2070040 |
| Quito                    |    1573458 |
| Cairo                    |    6789479 |
| Alexandria               |    3328196 |
| Giza                     |    2221868 |
| Madrid                   |    2879052 |
| Barcelona                |    1503451 |
| Cape Town                |    2352121 |
| Addis Abeba              |    2495000 |
| Quezon                   |    2173831 |
| Manila                   |    1581082 |
| Kalookan                 |    1177604 |
| Davao                    |    1147116 |
| Tbilisi                  |    1235200 |
| Accra                    |    1070000 |
| Conakry                  |    1090610 |
| Kowloon and New Kowloon  |    1987996 |
| Victoria                 |    1312637 |
| Jakarta                  |    9604900 |
| Surabaya                 |    2663820 |
| Bandung                  |    2429000 |
| Medan                    |    1843919 |
| Palembang                |    1222764 |
| Tangerang                |    1198300 |
| Semarang                 |    1104405 |
| Ujung Pandang            |    1060257 |
| Mumbai (Bombay)          |   10500000 |
| Delhi                    |    7206704 |
| Calcutta [Kolkata]       |    4399819 |
| Chennai (Madras)         |    3841396 |
| Hyderabad                |    2964638 |
| Ahmedabad                |    2876710 |
| Bangalore                |    2660088 |
| Kanpur                   |    1874409 |
| Nagpur                   |    1624752 |
| Lucknow                  |    1619115 |
| Pune                     |    1566651 |
| Surat                    |    1498817 |
| Jaipur                   |    1458483 |
| Indore                   |    1091674 |
| Bhopal                   |    1062771 |
| Ludhiana                 |    1042740 |
| Vadodara (Baroda)        |    1031346 |
| Kalyan                   |    1014557 |
| Baghdad                  |    4336000 |
| Teheran                  |    6758845 |
| Mashhad                  |    1887405 |
| Esfahan                  |    1266072 |
| Tabriz                   |    1191043 |
| Shiraz                   |    1053025 |
| Roma                     |    2643581 |
| Milano                   |    1300977 |
| Napoli                   |    1002619 |
| Wien                     |    1608144 |
| Tokyo                    |    7980230 |
| Jokohama [Yokohama]      |    3339594 |
| Osaka                    |    2595674 |
| Nagoya                   |    2154376 |
| Sapporo                  |    1790886 |
| Kioto                    |    1461974 |
| Kobe                     |    1425139 |
| Fukuoka                  |    1308379 |
| Kawasaki                 |    1217359 |
| Hiroshima                |    1119117 |
| Kitakyushu               |    1016264 |
| Beograd                  |    1204000 |
| Douala                   |    1448300 |
| Yaoundé                  |    1372800 |
| Montréal                 |    1016376 |
| Almaty                   |    1129400 |
| Nairobi                  |    2290000 |
| Shanghai                 |    9696300 |
| Peking                   |    7472000 |
| Chongqing                |    6351600 |
| Tianjin                  |    5286800 |
| Wuhan                    |    4344600 |
| Harbin                   |    4289800 |
| Shenyang                 |    4265200 |
| Kanton [Guangzhou]       |    4256300 |
| Chengdu                  |    3361500 |
| Nanking [Nanjing]        |    2870300 |
| Changchun                |    2812000 |
| Xi´an                    |    2761400 |
| Dalian                   |    2697000 |
| Qingdao                  |    2596000 |
| Jinan                    |    2278100 |
| Hangzhou                 |    2190500 |
| Zhengzhou                |    2107200 |
| Shijiazhuang             |    2041500 |
| Taiyuan                  |    1968400 |
| Kunming                  |    1829500 |
| Changsha                 |    1809800 |
| Nanchang                 |    1691600 |
| Fuzhou                   |    1593800 |
| Lanzhou                  |    1565800 |
| Guiyang                  |    1465200 |
| Ningbo                   |    1371200 |
| Hefei                    |    1369100 |
| Urumtši [Ürümqi]         |    1310100 |
| Anshan                   |    1200000 |
| Fushun                   |    1200000 |
| Nanning                  |    1161800 |
| Zibo                     |    1140000 |
| Qiqihar                  |    1070000 |
| Jilin                    |    1040000 |
| Tangshan                 |    1040000 |
| Santafé de Bogotá        |    6260862 |
| Cali                     |    2077386 |
| Medellín                 |    1861265 |
| Barranquilla             |    1223260 |
| Kinshasa                 |    5064000 |
| Pyongyang                |    2484000 |
| Seoul                    |    9981619 |
| Pusan                    |    3804522 |
| Inchon                   |    2559424 |
| Taegu                    |    2548568 |
| Taejon                   |    1425835 |
| Kwangju                  |    1368341 |
| Ulsan                    |    1084891 |
| La Habana                |    2256000 |
| Beirut                   |    1100000 |
| Tripoli                  |    1682000 |
| Kuala Lumpur             |    1297526 |
| Casablanca               |    2940623 |
| Ciudad de México         |    8591309 |
| Guadalajara              |    1647720 |
| Ecatepec de Morelos      |    1620303 |
| Puebla                   |    1346176 |
| Nezahualcóyotl           |    1224924 |
| Juárez                   |    1217818 |
| Tijuana                  |    1212232 |
| León                     |    1133576 |
| Monterrey                |    1108499 |
| Zapopan                  |    1002239 |
| Maputo                   |    1018938 |
| Rangoon (Yangon)         |    3361700 |
| Lagos                    |    1518000 |
| Ibadan                   |    1432000 |
| Abidjan                  |    2500000 |
| Karachi                  |    9269265 |
| Lahore                   |    5063499 |
| Faisalabad               |    1977246 |
| Rawalpindi               |    1406214 |
| Multan                   |    1182441 |
| Hyderabad                |    1151274 |
| Gujranwala               |    1124749 |
| Lima                     |    6464693 |
| Warszawa                 |    1615369 |
| Paris                    |    2125246 |
| Bucuresti                |    2016131 |
| Berlin                   |    3386667 |
| Hamburg                  |    1704735 |
| Munich [München]         |    1194560 |
| Lusaka                   |    1317000 |
| Riyadh                   |    3324000 |
| Jedda                    |    2046300 |
| Singapore                |    4017733 |
| Omdurman                 |    1271403 |
| Damascus                 |    1347000 |
| Aleppo                   |    1261983 |
| Taipei                   |    2641312 |
| Kaohsiung                |    1475505 |
| Dar es Salaam            |    1747000 |
| Bangkok                  |    6320174 |
| Praha                    |    1181126 |
| Istanbul                 |    8787958 |
| Ankara                   |    3038159 |
| Izmir                    |    2130359 |
| Adana                    |    1131198 |
| Bursa                    |    1095842 |
| Kyiv                     |    2624000 |
| Harkova [Harkiv]         |    1500000 |
| Dnipropetrovsk           |    1103000 |
| Donetsk                  |    1050000 |
| Odesa                    |    1011000 |
| Budapest                 |    1811552 |
| Montevideo               |    1236000 |
| Toskent                  |    2117500 |
| Minsk                    |    1674000 |
| Caracas                  |    1975294 |
| Maracaíbo                |    1304776 |
| Moscow                   |    8389200 |
| St Petersburg            |    4694000 |
| Novosibirsk              |    1398800 |
| Nizni Novgorod           |    1357000 |
| Jekaterinburg            |    1266300 |
| Samara                   |    1156100 |
| Omsk                     |    1148900 |
| Kazan                    |    1101000 |
| Ufa                      |    1091200 |
| Tšeljabinsk              |    1083200 |
| Rostov-na-Donu           |    1012700 |
| Perm                     |    1009700 |
| Ho Chi Minh City         |    3980000 |
| Hanoi                    |    1410000 |
| New York                 |    8008278 |
| Los Angeles              |    3694820 |
| Chicago                  |    2896016 |
| Houston                  |    1953631 |
| Philadelphia             |    1517550 |
| Phoenix                  |    1321045 |
| San Diego                |    1223400 |
| Dallas                   |    1188580 |
| San Antonio              |    1144646 |
| Harare                   |    1410000 |
+--------------------------+------------+
237 rows in set (0.00 sec)

mysql> SELECT Name FROM City WHERE Name LIKE 'Kal%';
+-------------+
| Name        |
+-------------+
| Kalookan    |
| Kalyan      |
| Kalemie     |
| Kallithea   |
| Kalisz      |
| Kaliningrad |
| Kaluga      |
+-------------+
7 rows in set (0.00 sec)

mysql> pager
Default pager wasn't set, using stdout.
mysql> SELECT Name FROM City WHERE Name LIKE 'Kal%';
+-------------+
| Name        |
+-------------+
| Kalookan    |
| Kalyan      |
| Kalemie     |
| Kallithea   |
| Kalisz      |
| Kaliningrad |
| Kaluga      |
+-------------+
7 rows in set (0.00 sec)

mysql> SELECT Id, Name, Population FROM City 
    -> WHERE ID IN (5, 32, 344, 554);
+-----+-------------------+------------+
| Id  | Name              | Population |
+-----+-------------------+------------+
|   5 | Amsterdam         |     731200 |
|  32 | Alkmaar           |      92713 |
| 344 | Guarapuava        |     160510 |
| 554 | Santiago de Chile |    4703954 |
+-----+-------------------+------------+
4 rows in set (0.00 sec)

mysql> SELECT * FROM City WHERE Name = 'Bratislava';
+------+------------+-------------+------------+------------+
| ID   | Name       | CountryCode | District   | Population |
+------+------------+-------------+------------+------------+
| 3209 | Bratislava | SVK         | Bratislava |     448292 |
+------+------------+-------------+------------+------------+
1 row in set (0.00 sec)

mysql> SELECT Name, Population FROM City 
    -> WHERE Population BETWEEN 670000 AND 700000;
+----------------+------------+
| Name           | Population |
+----------------+------------+
| Teresina       |     691942 |
| Natal          |     688955 |
| Bandar Lampung |     680332 |
| Gwalior        |     690765 |
| Kermanshah     |     692986 |
| Palermo        |     683794 |
| Toronto        |     688275 |
| Huainan        |     700000 |
| Jixi           |     683885 |
| Antananarivo   |     675669 |
| Chihuahua      |     670208 |
| Kano           |     674100 |
| Tunis          |     690600 |
+----------------+------------+
13 rows in set (0.01 sec)

mysql> SELECT Name, Population FROM City
    -> ORDER BY Population DESC LIMIT 10;
+-------------------+------------+
| Name              | Population |
+-------------------+------------+
| Mumbai (Bombay)   |   10500000 |
| Seoul             |    9981619 |
| São Paulo         |    9968485 |
| Shanghai          |    9696300 |
| Jakarta           |    9604900 |
| Karachi           |    9269265 |
| Istanbul          |    8787958 |
| Ciudad de México  |    8591309 |
| Moscow            |    8389200 |
| New York          |    8008278 |
+-------------------+------------+
10 rows in set (0.02 sec)

mysql> SELECT Name, Population FROM City 
    -> ORDER BY Population ASC LIMIT 10;
+---------------------+------------+
| Name                | Population |
+---------------------+------------+
| Adamstown           |         42 |
| West Island         |        167 |
| Fakaofo             |        300 |
| Città del Vaticano  |        455 |
| Bantam              |        503 |
| Yaren               |        559 |
| The Valley          |        595 |
| Alofi               |        682 |
| Flying Fish Cove    |        700 |
| Kingston            |        800 |
+---------------------+------------+
10 rows in set (0.00 sec)

mysql> SELECT Name, Population FROM City 
    -> ORDER BY Name LIMIT 10;
+------------------------+------------+
| Name                   | Population |
+------------------------+------------+
| A Coruña (La Coruña)   |     243402 |
| Aachen                 |     243825 |
| Aalborg                |     161161 |
| Aba                    |     298900 |
| Abadan                 |     206073 |
| Abaetetuba             |     111258 |
| Abakan                 |     169200 |
| Abbotsford             |     105403 |
| Abeokuta               |     427400 |
| Aberdeen               |     213070 |
+------------------------+------------+
10 rows in set (0.00 sec)

mysql> DESC City
    -> ;
+-------------+----------+------+-----+---------+----------------+
| Field       | Type     | Null | Key | Default | Extra          |
+-------------+----------+------+-----+---------+----------------+
| ID          | int(11)  | NO   | PRI | NULL    | auto_increment |
| Name        | char(35) | NO   |     |         |                |
| CountryCode | char(3)  | NO   |     |         |                |
| District    | char(20) | NO   |     |         |                |
| Population  | int(11)  | NO   |     | 0       |                |
+-------------+----------+------+-----+---------+----------------+
5 rows in set (0.00 sec)

mysql> SELECT District, SUM(Population) FROM City
    -> WHERE District = 'New York' GROUP BY District;
+----------+-----------------+
| District | SUM(Population) |
+----------+-----------------+
| New York |         8958085 |
+----------+-----------------+
1 row in set (0.04 sec)

mysql> SELECT Name, SUM(Population) FROM City
    -> WHERE District = 'New York' GROUP BY District;
+----------+-----------------+
| Name     | SUM(Population) |
+----------+-----------------+
| New York |         8958085 |
+----------+-----------------+
1 row in set (0.00 sec)

mysql> SELECT Name, District, Population FROM City
    -> WHERE District = 'New York';
+-----------+----------+------------+
| Name      | District | Population |
+-----------+----------+------------+
| New York  | New York |    8008278 |
| Buffalo   | New York |     292648 |
| Rochester | New York |     219773 |
| Yonkers   | New York |     196086 |
| Syracuse  | New York |     147306 |
| Albany    | New York |      93994 |
+-----------+----------+------------+
6 rows in set (0.00 sec)

mysql> SELECT District, SUM(Population) FROM City
    -> WHERE CountryCode = 'USA' GROUP BY District
    -> HAVING SUM(Population) > 3000000;
+------------+-----------------+
| District   | SUM(Population) |
+------------+-----------------+
| Arizona    |         3178903 |
| California |        16716706 |
| Florida    |         3151408 |
| Illinois   |         3737498 |
| New York   |         8958085 |
| Texas      |         9208281 |
+------------+-----------------+
6 rows in set (0.00 sec)

mysql> SELECT Name, HeadOfState FROM Country
    -> WHERE Name = 'United States';
+---------------+----------------+
| Name          | HeadOfState    |
+---------------+----------------+
| United States | George W. Bush |
+---------------+----------------+
1 row in set (0.02 sec)

mysql> UPDATE Country SET HeadOfState = 'Barack Obama'
    -> WHERE Name = 'United States';
Query OK, 1 row affected (0.00 sec)
Rows matched: 1  Changed: 1  Warnings: 0

mysql> SELECT Name, HeadOfState FROM Country
    -> WHERE Name = 'United States';
+---------------+--------------+
| Name          | HeadOfState  |
+---------------+--------------+
| United States | Barack Obama |
+---------------+--------------+
1 row in set (0.00 sec)

mysql> CREATE TABLE First10 engine=MEMORY SELECT * FROM City LIMIT 10;
Query OK, 10 rows affected (0.08 sec)
Records: 10  Duplicates: 0  Warnings: 0

mysql> SELECT * FROM First10;
+----+----------------+-------------+---------------+------------+
| ID | Name           | CountryCode | District      | Population |
+----+----------------+-------------+---------------+------------+
|  1 | Kabul          | AFG         | Kabol         |    1780000 |
|  2 | Qandahar       | AFG         | Qandahar      |     237500 |
|  3 | Herat          | AFG         | Herat         |     186800 |
|  4 | Mazar-e-Sharif | AFG         | Balkh         |     127800 |
|  5 | Amsterdam      | NLD         | Noord-Holland |     731200 |
|  6 | Rotterdam      | NLD         | Zuid-Holland  |     593321 |
|  7 | Haag           | NLD         | Zuid-Holland  |     440900 |
|  8 | Utrecht        | NLD         | Utrecht       |     234323 |
|  9 | Eindhoven      | NLD         | Noord-Brabant |     201843 |
| 10 | Tilburg        | NLD         | Noord-Brabant |     193238 |
+----+----------------+-------------+---------------+------------+
10 rows in set (0.00 sec)

mysql> DELETE FROM First10 WHERE ID IN (2, 4, 6, 8, 10);
Query OK, 5 rows affected (0.04 sec)

mysql> SELECT * FROM First10;
+----+-----------+-------------+---------------+------------+
| ID | Name      | CountryCode | District      | Population |
+----+-----------+-------------+---------------+------------+
|  1 | Kabul     | AFG         | Kabol         |    1780000 |
|  3 | Herat     | AFG         | Herat         |     186800 |
|  5 | Amsterdam | NLD         | Noord-Holland |     731200 |
|  7 | Haag      | NLD         | Zuid-Holland  |     440900 |
|  9 | Eindhoven | NLD         | Noord-Brabant |     201843 |
+----+-----------+-------------+---------------+------------+
5 rows in set (0.00 sec)

mysql> TRUNCATE TABLE First10;
Query OK, 0 rows affected (0.00 sec)

mysql> SELECT * FROM First10;
Empty set (0.00 sec)

mysql> INSERT INTO First10 VALUES(1, 'Kabul', 'AFG', 'Kabol', 1780000);
Query OK, 1 row affected (0.00 sec)

mysql> SELECT * FROM First10;
+----+-------+-------------+----------+------------+
| ID | Name  | CountryCode | District | Population |
+----+-------+-------------+----------+------------+
|  1 | Kabul | AFG         | Kabol    |    1780000 |
+----+-------+-------------+----------+------------+
1 row in set (0.00 sec)

mysql> show tables;
+-----------------+
| Tables_in_world |
+-----------------+
| City            |
| Country         |
| CountryLanguage |
| First10         |
+-----------------+
4 rows in set (0.00 sec)

mysql> DROP TABLE First10;
Query OK, 0 rows affected (0.02 sec)

mysql> show tables;
+-----------------+
| Tables_in_world |
+-----------------+
| City            |
| Country         |
| CountryLanguage |
+-----------------+
3 rows in set (0.00 sec)

mysql> SHOW VARIABLES LIKE 'storage_engine';
+----------------+--------+
| Variable_name  | Value  |
+----------------+--------+
| storage_engine | InnoDB |
+----------------+--------+
1 row in set (0.00 sec)

mysql> SELECT ENGINE FROM information_schema.TABLES
    -> WHERE TABLE_SCHEMA='mydb'
    -> AND TABLE_NAME='Cars';
+--------+
| ENGINE |
+--------+
| InnoDB |
+--------+
1 row in set (0.00 sec)

mysql> ALTER TABLE Cars ENGINE='MyISAM';
ERROR 1146 (42S02): Table 'world.Cars' doesn't exist
mysql> use mydb;
Reading table information for completion of table and column names
You can turn off this feature to get a quicker startup with -A

Database changed
mysql> ALTER TABLE Cars ENGINE='MyISAM';
Query OK, 8 rows affected (0.21 sec)
Records: 8  Duplicates: 0  Warnings: 0

mysql> SELECT ENGINE FROM information_schema.TABLES
    -> WHERE TABLE_SCHEMA='mydb'
    -> AND TABLE_NAME='Cars';
+--------+
| ENGINE |
+--------+
| MyISAM |
+--------+
1 row in set (0.00 sec)

mysql> CREATE TABLE Ages(Id SMALLINT, Age TINYINT) ENGINE=Memory;
Query OK, 0 rows affected (0.06 sec)

mysql> INSERT INTO Ages VALUES(1, 43);
Query OK, 1 row affected (0.00 sec)

mysql> INSERT INTO Ages VALUES(2, 128);
Query OK, 1 row affected, 1 warning (0.00 sec)

mysql> SHOW WARNINGS;
+---------+------+----------------------------------------------+
| Level   | Code | Message                                      |
+---------+------+----------------------------------------------+
| Warning | 1264 | Out of range value for column 'Age' at row 1 |
+---------+------+----------------------------------------------+
1 row in set (0.00 sec)

mysql> ALTER TABLE Ages MODIFY Age TINYINT UNSIGNED;
Query OK, 2 rows affected (0.05 sec)
Records: 2  Duplicates: 0  Warnings: 0

mysql> INSERT INTO Ages VALUES(3, 240);
Query OK, 1 row affected (0.00 sec)

mysql> SELECT * FROM Ages;
+------+------+
| Id   | Age  |
+------+------+
|    1 |   43 |
|    2 |  127 |
|    3 |  240 |
+------+------+
3 rows in set (0.00 sec)

mysql> select 1/3;
+--------+
| 1/3    |
+--------+
| 0.3333 |
+--------+
1 row in set (0.00 sec)

mysql> select 0.3333 = 1/3
    -> ;
+--------------+
| 0.3333 = 1/3 |
+--------------+
|            0 |
+--------------+
1 row in set (0.00 sec)

mysql> CREATE TABLE Numbers (Id TINYINT, Floats FLOAT, Decimals DECIMAL(3, 2));
Query OK, 0 rows affected (0.11 sec)

mysql> INSERT INTO Numbers VALUES (1, 1.1, 1.1), (2, 1.1, 1.1), (3, 1.1, 1.1);
Query OK, 3 rows affected (0.04 sec)
Records: 3  Duplicates: 0  Warnings: 0

mysql> SELECT * FROM Numbers;
+------+--------+----------+
| Id   | Floats | Decimals |
+------+--------+----------+
|    1 |    1.1 |     1.10 |
|    2 |    1.1 |     1.10 |
|    3 |    1.1 |     1.10 |
+------+--------+----------+
3 rows in set (0.00 sec)

mysql> SELECT SUM(Floats), SUM(Decimals) FROM Numbers;
+--------------------+---------------+
| SUM(Floats)        | SUM(Decimals) |
+--------------------+---------------+
| 3.3000000715255737 |          3.30 |
+--------------------+---------------+
1 row in set (0.00 sec)

mysql> show tables;
+----------------+
| Tables_in_mydb |
+----------------+
| Ages           |
| Books          |
| Cars           |
| Customers      |
| Numbers        |
| Reservations   |
+----------------+
6 rows in set (0.00 sec)

mysql> CREATE TABLE Dates(Id TINYINT, Dates DATE);
Query OK, 0 rows affected (0.09 sec)

mysql> INSERT INTO Dates VALUES(1, '2011-01-24');
Query OK, 1 row affected (0.04 sec)

mysql> INSERT INTO Dates VALUES(2, '2011/01/25');
Query OK, 1 row affected (0.05 sec)

mysql> INSERT INTO Dates VALUES(3, '20110126');
Query OK, 1 row affected (0.04 sec)

mysql> INSERT INTO Dates VALUES(4, '110127');
Query OK, 1 row affected (0.03 sec)

mysql> INSERT INTO Dates VALUES(5, '2011+01+28');
Query OK, 1 row affected (0.03 sec)

mysql> select * from Dates;
+------+------------+
| Id   | Dates      |
+------+------------+
|    1 | 2011-01-24 |
|    2 | 2011-01-25 |
|    3 | 2011-01-26 |
|    4 | 2011-01-27 |
|    5 | 2011-01-28 |
+------+------------+
5 rows in set (0.00 sec)

mysql> INSERT INTO Dates VALUES (6, '10000-01-01');
Query OK, 1 row affected, 1 warning (0.06 sec)

mysql> SHOW WARNINGS;
+---------+------+--------------------------------------------+
| Level   | Code | Message                                    |
+---------+------+--------------------------------------------+
| Warning | 1265 | Data truncated for column 'Dates' at row 1 |
+---------+------+--------------------------------------------+
1 row in set (0.00 sec)

mysql> SELECT Id, Dates FROM Dates WHERE Id=6;
+------+------------+
| Id   | Dates      |
+------+------------+
|    6 | 0000-00-00 |
+------+------------+
1 row in set (0.00 sec)

mysql> SELECT TIMEDIFF('23:34:32', '22:00:00');
+----------------------------------+
| TIMEDIFF('23:34:32', '22:00:00') |
+----------------------------------+
| 01:34:32                         |
+----------------------------------+
1 row in set (0.01 sec)

mysql> SELECT TIME('2011-01-29 11:27:42');
+-----------------------------+
| TIME('2011-01-29 11:27:42') |
+-----------------------------+
| 11:27:42                    |
+-----------------------------+
1 row in set (0.00 sec)

mysql> SELECT TIMEDIFF('211344', 201123);
+----------------------------+
| TIMEDIFF('211344', 201123) |
+----------------------------+
| 01:02:21                   |
+----------------------------+
1 row in set (0.00 sec)

mysql> SELECT DAYNAME('2011@01@29 11@50@13');
+--------------------------------+
| DAYNAME('2011@01@29 11@50@13') |
+--------------------------------+
| Saturday                       |
+--------------------------------+
1 row in set (0.02 sec)

mysql> CREATE TABLE Prices(Id TINYINT, Price Decimal(8, 2), Stamp TIMESTAMP);
Query OK, 0 rows affected (0.10 sec)

mysql> INSERT INTO Prices (Id, Price) VALUES (1, 234.34);
Query OK, 1 row affected (0.04 sec)

mysql> INSERT INTO Prices (Id, Price) VALUES (2, 344.12);
Query OK, 1 row affected (0.04 sec)

mysql> SELECT * FROM Prices;
+------+--------+---------------------+
| Id   | Price  | Stamp               |
+------+--------+---------------------+
|    1 | 234.34 | 2014-12-20 17:05:17 |
|    2 | 344.12 | 2014-12-20 17:05:26 |
+------+--------+---------------------+
2 rows in set (0.00 sec)

mysql> UPDATE Prices SET Price=250.50 WHERE Id=1;
Query OK, 1 row affected (0.03 sec)
Rows matched: 1  Changed: 1  Warnings: 0

mysql> SELECT * FROM Prices;
+------+--------+---------------------+
| Id   | Price  | Stamp               |
+------+--------+---------------------+
|    1 | 250.50 | 2014-12-20 17:06:00 |
|    2 | 344.12 | 2014-12-20 17:05:26 |
+------+--------+---------------------+
2 rows in set (0.00 sec)

mysql> CREATE TABLE Chars(Id TINYINT, Chars CHAR(3));
Query OK, 0 rows affected (0.09 sec)

mysql> show tables;
+----------------+
| Tables_in_mydb |
+----------------+
| Ages           |
| Books          |
| Cars           |
| Chars          |
| Customers      |
| Dates          |
| Numbers        |
| Prices         |
| Reservations   |
+----------------+
9 rows in set (0.00 sec)

mysql> INSERT INTO Chars VALUES (1, 'a'), (2, 'ab'), (3, 'abc'), (4, 'abce');
Query OK, 4 rows affected, 1 warning (0.03 sec)
Records: 4  Duplicates: 0  Warnings: 1

mysql> SHOW WARNINGS;
+---------+------+--------------------------------------------+
| Level   | Code | Message                                    |
+---------+------+--------------------------------------------+
| Warning | 1265 | Data truncated for column 'Chars' at row 4 |
+---------+------+--------------------------------------------+
1 row in set (0.00 sec)

mysql> SELECT * FROM Chars;
+------+-------+
| Id   | Chars |
+------+-------+
|    1 | a     |
|    2 | ab    |
|    3 | abc   |
|    4 | abc   |
+------+-------+
4 rows in set (0.00 sec)

mysql> SELECT Id, LENGTH(Chars) AS Length FROM Chars;
+------+--------+
| Id   | Length |
+------+--------+
|    1 |      1 |
|    2 |      2 |
|    3 |      3 |
|    4 |      3 |
+------+--------+
4 rows in set (0.00 sec)

mysql> SET sql_mode = 'PAD_CHAR_TO_FULL_LENGTH';
Query OK, 0 rows affected (0.00 sec)

mysql> SELECT Id, LENGTH(Chars) AS Length FROM Chars;
+------+--------+
| Id   | Length |
+------+--------+
|    1 |      3 |
|    2 |      3 |
|    3 |      3 |
|    4 |      3 |
+------+--------+
4 rows in set (0.00 sec)

mysql> CREATE TABLE FirstNames(Id TINYINT, FirstName VARCHAR(20));
Query OK, 0 rows affected (0.11 sec)

mysql> INSERT INTO FirstNames VALUES (1, 'Tom'), (2, 'Lucy'), (3, 'Alice'), 
    -> (4, 'Robert'), (5, 'Timothy'), (6, 'Alexander');
Query OK, 6 rows affected (0.03 sec)
Records: 6  Duplicates: 0  Warnings: 0

mysql> SELECT Id, LENGTH(FirstName) AS Length FROM FirstNames;
+------+--------+
| Id   | Length |
+------+--------+
|    1 |      3 |
|    2 |      4 |
|    3 |      5 |
|    4 |      6 |
|    5 |      7 |
|    6 |      9 |
+------+--------+
6 rows in set (0.00 sec)

mysql> CREATE TABLE SizeTable(Size ENUM('S', 'M', 'L', 'XL', 'XXL'));
Query OK, 0 rows affected (0.10 sec)

mysql> INSERT INTO SizeTable VALUES ('S'), ('L');
Query OK, 2 rows affected (0.04 sec)
Records: 2  Duplicates: 0  Warnings: 0

mysql> INSERT INTO SizeTable VALUES ('Large');
Query OK, 1 row affected, 1 warning (0.04 sec)

mysql> SELECT * FROM SizeTable;
+------+
| Size |
+------+
| S    |
| L    |
|      |
+------+
3 rows in set (0.00 sec)

mysql> exit
mysql> SELECT 3*3=9, 9=9;
+-------+-----+
| 3*3=9 | 9=9 |
+-------+-----+
|     1 |   1 |
+-------+-----+
1 row in set (0.00 sec)

mysql> SELECT 3 < 4, 3 <> 5, 4 <= 4, 5 != 5;
+-------+--------+--------+--------+
| 3 < 4 | 3 <> 5 | 4 <= 4 | 5 != 5 |
+-------+--------+--------+--------+
|     1 |      1 |      1 |      0 |
+-------+--------+--------+--------+
1 row in set (0.00 sec)

mysql> SELECT 6 & 3, 3 & 6;
+-------+-------+
| 6 & 3 | 3 & 6 |
+-------+-------+
|     2 |     2 |
+-------+-------+
1 row in set (0.00 sec)

mysql> SELECT 6 | 3, 3 | 6;
+-------+-------+
| 6 | 3 | 3 | 6 |
+-------+-------+
|     7 |     7 |
+-------+-------+
1 row in set (0.00 sec)

mysql> SELECT 6 >> 1;
+--------+
| 6 >> 1 |
+--------+
|      3 |
+--------+
1 row in set (0.00 sec)

mysql> SELECT 6 << 1;
+--------+
| 6 << 1 |
+--------+
|     12 |
+--------+
1 row in set (0.00 sec)

mysql> SET @running = FALSE;
Query OK, 0 rows affected (0.00 sec)

mysql> SELECT @running IS FALSE;
+-------------------+
| @running IS FALSE |
+-------------------+
|                 1 |
+-------------------+
1 row in set (0.00 sec)

mysql> SELECT 'Tom' IN ('Tom', 'Frank', 'Jane');
+-----------------------------------+
| 'Tom' IN ('Tom', 'Frank', 'Jane') |
+-----------------------------------+
|                                 1 |
+-----------------------------------+
1 row in set (0.00 sec)

mysql> SELECT * FROM Cars;
ERROR 1046 (3D000): No database selected
mysql> use mydb;
Reading table information for completion of table and column names
You can turn off this feature to get a quicker startup with -A

Database changed
mysql> SELECT * FROM Cars;
+----+------------+--------+
| Id | Name       | Cost   |
+----+------------+--------+
|  1 | Audi       |  52642 |
|  2 | Mercedes   |  57127 |
|  3 | Skoda      |   9000 |
|  4 | Volvo      |  29000 |
|  5 | Bentley    | 350000 |
|  6 | Citroen    |  21000 |
|  7 | Hummer     |  41400 |
|  8 | Volkswagen |  21600 |
+----+------------+--------+
8 rows in set (0.00 sec)

mysql> SELECT * FROM Cars Where Name IN ('Audi', 'Hummer');
+----+--------+-------+
| Id | Name   | Cost  |
+----+--------+-------+
|  1 | Audi   | 52642 |
|  7 | Hummer | 41400 |
+----+--------+-------+
2 rows in set (0.00 sec)

mysql> SELECT * FROM Cars WHERE Name LIKE 'Vol%';
+----+------------+-------+
| Id | Name       | Cost  |
+----+------------+-------+
|  4 | Volvo      | 29000 |
|  8 | Volkswagen | 21600 |
+----+------------+-------+
2 rows in set (0.00 sec)

mysql> SELECT * FROM Cars WHERE Name LIKE '____';
+----+------+-------+
| Id | Name | Cost  |
+----+------+-------+
|  1 | Audi | 52642 |
+----+------+-------+
1 row in set (0.00 sec)

mysql> exit
mysql> CREATE TABLE Books2(Id INTEGER PRIMARY KEY AUTO_INCREMENT,
    -> Title VARCHAR(100), Author VARCHAR(60)) type=MEMORY;
ERROR 1046 (3D000): No database selected
mysql> use mydb
Reading table information for completion of table and column names
You can turn off this feature to get a quicker startup with -A

Database changed
mysql> CREATE TABLE Books2(Id INTEGER PRIMARY KEY AUTO_INCREMENT,
    -> Title VARCHAR(100), Author VARCHAR(60)) type=MEMORY;
ERROR 1064 (42000): You have an error in your SQL syntax; check the manual that corresponds to your MySQL server version for the right syntax to use near 'type=MEMORY' at line 2
mysql> CREATE TABLE Books2(Id INTEGER PRIMARY KEY AUTO_INCREMENT,
    -> Title VARCHAR(100), Author VARCHAR(60)) engine=memory;
Query OK, 0 rows affected (0.07 sec)

mysql> INSERT INTO Books2 SELECT * FROM Books;
Query OK, 5 rows affected (0.02 sec)
Records: 5  Duplicates: 0  Warnings: 0

mysql> SELECT * FROM Books2;
+----+------------------------+--------------------+
| Id | Title                  | Author             |
+----+------------------------+--------------------+
|  1 | War and Peace          | Leo Tolstoy        |
|  2 | The Brothers Karamazov | Fyodor Dostoyevsky |
|  3 | Paradise Lost          | John Milton        |
|  4 | Crime and Punishment   | Fyodor Dostoyevsky |
|  5 | Cousin Bette           | Honore de Balzac   |
+----+------------------------+--------------------+
5 rows in set (0.00 sec)

mysql> INSERT INTO Books(Title, Author) VALUES ('The Insulted and Humiliated',
    -> 'Fyodor Dostoyevsky'), ('Cousin Bette', 'Honore de Balzac');
ERROR 1062 (23000): Duplicate entry '0' for key 'PRIMARY'
mysql> SELECT * FROM Books2;
+----+------------------------+--------------------+
| Id | Title                  | Author             |
+----+------------------------+--------------------+
|  1 | War and Peace          | Leo Tolstoy        |
|  2 | The Brothers Karamazov | Fyodor Dostoyevsky |
|  3 | Paradise Lost          | John Milton        |
|  4 | Crime and Punishment   | Fyodor Dostoyevsky |
|  5 | Cousin Bette           | Honore de Balzac   |
+----+------------------------+--------------------+
5 rows in set (0.00 sec)

mysql> INSERT INTO Books(Title, Author) VALUES ('The Insulted and Humiliated',
    -> Ctrl-C -- exit!
Aborted
mysql> SELECT * INTO OUTFILE '/tmp/books.csv'
    -> FIELDS TERMINATED BY ','
    -> LINES TERMINATED BY '\n'
    -> FROM Books;
ERROR 1045 (28000): Access denied for user 'user1'@'localhost' (using password: YES)
mysql> 
mysql> exit
